home,dir_name,author,year,title
.,Q7TPWEPR,Krumholz et al.,2015,Star Cluster Properties In Two Legus Galaxies Comp
.,TPDMYXI3,Krumholz et al.,2015,Slug – Stochastically Lighting Up Galaxies – Iii. 
.,VRAVJXW3,Kumeria et al.,2015,Membranes Photoswitchable Membranes Based On Pept
.,XISAY85W,Kvale et al.,2015,Potential Increasing Dominance Of Heterotrophy In 
.,6ERCH8JJ,Kvistad et al.,2015,Very Low Population Structure In A Highly Mobile A
.,D3TT5ISN,Lai et al.,2015,Identification And Characterization Of More Than 4
.,35PGTSWN,Lattanzio et al.,2015,On The Numerical Treatment And Dependence Of Therm
.,W4NTQTYR,Laucht et al.,2015,Electrically Controlling Single-Spin Qubits In A C
.,K4TNF7UM,Leontini et al.,2015,Stability Analysis Of The Elliptic Cylinder Wake
.,YDKN3SQB,Lepodise et al.,2015,"Terahertz Spectroscopy Of 2,4-Dinitrotoluene Over "
.,TBV8F6EL,Ley et al.,2015,Surface-Water Interface Induces Conformational Cha
.,IEKTQA7T,Li et al.,2015,The Characterization Of Modified Starch Branching 
.,2K5UQ6X8,Li et al.,2015,Uncoupled Surface Spin Induced Exchange Bias In Α-
.,XTN733IE,Li et al.,2015,A Functional Correlate Of Severity In Alternating 
.,NDM2ZYCB,Li et al.,2015,Performance Modulation Of Α-Mno2 Nanowires By Crys
.,HXUD3IDY,Li et al.,2015,Patient-Specific Biomechanical Model As Whole-Body
.,RFY6YJRW,Liao et al.,2015,Electronic Coupling And Catalytic Effect On H2 Evo
.,ETHEIBBD,Lillie et al.,2015,Selection On Mhc Class Ii Supertypes In The New Ze
.,G78LMXIL,Lin et al.,2015,3d Hierarchical Rutile Tio2 And Metal-Free Organic
.,CAGR6FBP,Liu et al.,2015,Adsorption Of Ch4 And Ch4co2 Mixtures In Carbon N
.,E6EYAZW8,Liu et al.,2015,Nearly Exclusive Growth Of Small Diameter Semicond
.,F9S532VE,Liu et al.,2015,Two-Step Self-Assembly Of Hierarchically-Ordered N
.,BPIHG977,Loi et al.,2015,Quantifying Ionospheric Effects On Time-Domain Ast
.,V2EHIJGU,Loi et al.,2015,Real‐Time Imaging Of Density Ducts Between The Pla
.,RGT4ZIP3,Loi et al.,2015,Power Spectrum Analysis Of Ionospheric Fluctuation
.,5PYWLBU9,Löptien et al.,2015,Helioseismology With Solar Orbiter
.,NVWV2JJQ,Lu et al.,2015,Sulfur Derivatives Of The Natural Polyarsenical Ar
.,HP9KVDRM,Lugaro et al.,2015,Post-Agb Stars In The Magellanic Clouds And Neutro
.,Q9JDWM68,Ma et al.,2015,Single Layer Bismuth Iodide Computational Explora
.,W6E65V7R,Ma et al.,2015,Quantum Spin Hall Effect And Topological Phase Tra
.,TRB6D6EL,Mahdavi and Kuyucak,2015,Mechanism Of Ion Permeation In Mammalian Voltage-G
.,YFPFNPJF,Maher et al.,2015,Effects Of Volcanism On Tropical Variability Effe
.,NLKXQ48Y,Malde and Mark,2015,179 Validation Of Ligands In X-Ray Crystal Structu
.,IL8SLS5S,Mao et al.,2015,Optimal Suppression Of Flow Perturbations Using Bo
.,AYXFUDLP,Mao et al.,2015,Nonlinear Optimal Suppression Of Vortex Shedding F
.,3C6GPENZ,Markworth et al.,2015,Photoisomerization Action Spectroscopy Flicking T
.,2GTSEGQL,Marquardt et al.,2015,Type Ia Supernovae From Exploding Oxygen-Neon Whit
.,BHQQXEAW,Marshall et al.,2015,Experimental Evidence For Competitive N O And O C 
.,A4GGLJK3,Mastrano et al.,2015,Interpreting The Axp 1e 2259+586 Antiglitch As A C
.,LQTS7FKH,Mastrano et al.,2015,Neutron Star Deformation Due To Poloidal–Toroidal 
.,NJ2H8B4I,Matear et al.,2015,Sources Of Heterogeneous Variability And Trends In
.,L5FTQLU7,Matsumoto et al.,2015,Can Direct Collapse Black Holes Launch Gamma-Ray B
.,8H6SWQYW,Mayewski et al.,2015,Potential For Southern Hemisphere Climate Surprise
.,8DTPETJC,McBride et al.,2015,Mri Using Ultrasmall Superparamagnetic Particles O
.,E6W2NK4Q,McKemmish et al.,2015,Electron–Vibration Entanglement In The Born–Oppenh
.,M44ZH64E,McKinley et al.,2015,Modelling Of The Spectral Energy Distribution Of F
.,D5SQ385B,McLaren et al.,2015,Marital Status And Suicidal Ideation Among Austral
.,UIK2GZIW,McLaren et al.,2015,Marital Status And Suicidal Ideation Among Austral
.,LG5QV7RE,McLean et al.,2015,Nanostructure Of [Li(G4)] Tfsi And [Li(G4)] No Su
.,H7VJQPZZ,McRae et al.,2015,Linking Local Wildfire Dynamics To Pyrocb Developm
.,29MR9HG8,Meehl et al.,2015,Effects Of The Mount Pinatubo Eruption On Decadal 
.,N5VIPZPZ,Menon and Heger,2015,The Quest For Blue Supergiants Evolution Of Binar
.,GTT8DAE4,Menviel et al.,2015,Impact Of Oceanic Circulation Changes On Atmospher
.,D4NKVQWS,Mereghetti et al.,2015,"Magnetars Properties, Origin And Evolution"
.,UFTRCP9X,Messenger et al.,2015,Gravitational Waves From Scorpius X-1 A Compariso
.,3V4Q9YZD,Michałowski et al.,2015,Massive Stars Formed In Atomic Hydrogen Reservoirs
.,8ZKM9A68,Michelassi et al.,2015,Compressible Direct Numerical Simulation Of Low-Pr
.,FINU7BED,Mitchell and Page,2015,Structure And Absorption In C60–Zinc Tetra-Phenylp
.,3A9USRMQ,Mohd-Yusoff et al.,2015,Scanning The Effects Of Ethyl Methanesulfonate On 
.,IIBJWC37,Mol et al.,2015,Interface-Induced Heavy-Holelight-Hole Splitting 
.,5VFN3C8U,Moradi et al.,2015,Directional Time–Distance Probing Of Model Sunspot
.,ANQ9PUC9,Morishita and Spencer,2015,How Silicene On Ag(111) Oxidizes Microscopic Mech
.,INJXE5KS,Morris et al.,2015,"Identification, Characterisation And Expression An"
.,MMJNAJ37,Morris et al.,2015,Lack Of Genetic Diversity Across Diverse Immune Ge
.,7JZL9LBJ,Morris et al.,2015,Identification And Analysis Of Divergent Immune Ge
.,FHHKPI3J,Mostert et al.,2015,Effects Of Magnetic Fields On Magnetohydrodynamic 
.,4XWS4Q22,Murphy et al.,2015,Swimming Through Sand Connectivity Of Aquatic Fau
.,7MUBH294,Mustapić et al.,2015,Improvements In The Dispersion Of Nanosilver In A 
.,P7YU99TW,Myers et al.,2015,Bayesian Approach To Time-Resolved Tomography
.,25YUU52G,Neben et al.,2015,Measuring Phased-Array Antenna Beampatterns With H
.,A5P2GN2G,Nemes et al.,2015,Mutual Inductance Of Two Helical Vortices
.,8SZI3HUF,Nemoda et al.,2015,Maternal Depression Is Associated With Dna Methyla
.,HHJX78WZ,Newman and Easteal,2015,A New Metric Of Inclusive Fitness Predicts The Hum
.,F9AHDPFR,Ng et al.,2015,Nonlinear Processes Reinforce Extreme Indian Ocean
.,SXI2UVI6,Ng et al.,2015,Vertical Natural Convection Application Of The Un
.,G8FW8ALD,Ng et al.,2015,The Role Of The Sst-Thermocline Relationship In In
.,2HFJEF6S,Nguyen et al.,2015,Identification Of Chikungunya Virus Nsp2 Protease 
.,RBD3M9Z9,Nickless et al.,2015,Greenhouse Gas Network Design Using Backward Lagra
.,63VBI3R9,Nolan et al.,2015,The Density Variance–Mach Number Relation In Isoth
.,GAPBYLQP,Offringa et al.,2015,The Low-Frequency Environment Of The Murchison Wid
.,QLEW59UW,Ogrean et al.,2015,Frontier Fields Clusters Chandra And Jvla 
.,2ZUGRCTZ,Olivetti et al.,2015,Direct Numerical Simulation Of Turbulent Flow With
.,WNFCTRPC,Open Science Collaboration,2015,Estimating The Reproducibility Of Psychological Sc
.,ZZ5UL546,Oppermann et al.,2015,Estimating Extragalactic Faraday Rotation
.,WKZ9NQ8E,Ord et al.,2015,The Murchison Widefield Array Correlator
.,XFXMVB73,Oronsaye et al.,2015,Simultaneous Observations Of Giant Pulses From The
.,UT8CC93C,Owen et al.,2015,Transition Of Ρ → Π Γ In Lattice Qcd
.,ZWPIFRH6,Owen et al.,2015,Light Meson Form Factors At Near Physical Masses
.,CB3GT3BC,Page et al.,2015,Quantum Chemical Simulation Of Carbon Nanotube Nuc
.,F6MX5787,Pahnke et al.,2015,Entropy Driven Chain Effects On Ligation Chemistry
.,UPTPE2QU,Pan et al.,2015,500 Days Of Sn 2013dy Spectra And Photometry From
.,CWKU5H3Y,Papaioannou et al.,2015,Molecular Dynamics Simulations Of Insulin Elucida
.,7MJJGS2Q,Patnaude et al.,2015,Are Models For Core-Collapse Supernova Progenitors
.,KNRFVGTN,Pattanawongsa et al.,2015,Inhibition Of Human Udp-Glucuronosyltransferase En
.,7IUHZAVB,Perrott et al.,2015,Ami Galactic Plane Survey At 16 Ghz – Ii. Full Dat
.,8YRXR5F2,Petasecca et al.,2015,Magicplate-512 A 2d Silicon Detector Array For Qu
.,7JR4KAJW,Petit et al.,2015,Mixing And Transport Of Metals By Gravitational In
.,IDNGUCV7,Pham et al.,2015,Dissociation Of Proton-Bound Complexes Reveals Geo
.,ZECN54NZ,Pham et al.,2015,Orbital Engineering Of Two-Dimensional Materials W
.,A3NKA84E,Pigott et al.,2015,Calculation Of The Energetics Of Water Incorporati
.,ISD5K32D,Piwiński et al.,2015,E-Zn Inelastic Scattering At 80 Ev
.,5JWXDKKC,Placco et al.,2015,Metal-Poor Stars Observed With The Magellan
.,UNSPDSU2,Planck Collaboration et al.,2015,Planck 2013 Results. Xxxii. The Updated 
.,R4RS35TC,Pope et al.,2015,The Investigation Of Prostatic Calcifications Usin
.,3KTUBCFM,Prabu et al.,2015,A Digital-Receiver For The Murchisonwidefield Arra
.,76VA6MPR,Przybylski et al.,2015,Spectropolarimetrically Accurate Magnetohydrostati
.,QZF242RG,Quek et al.,2015,In-Line Deoxygenation For Organic Carbon Detection
.,AHMLQ7NV,Quek et al.,2015,Microbial Fuel Cell Biosensor For Rapid Assessment
.,SICYHNCA,Raiteri et al.,2015,Thermodynamically Consistent Force Field For Molec
.,RNZXCU3K,Ramesh et al.,2015,Significance Of Thermal Fluctuations And Hydrodyna
.,3MNFJB4G,Rashid et al.,2015,A Potent And Kv1.3-Selective Analogue Of The Scorp
.,NTAIP49B,Rayner et al.,2015,Recent Changes In The Global And Regional Carbon C
.,255DRKRV,Razaghi et al.,2015,Increased Expression And Secretion Of Recombinant 
.,4AJHK6KJ,Regenauer-Lieb et al.,2015,Deep Geothermal The ‘Moon Landing’ Mission In The
.,SXTRUX6Q,Regenauer-Lieb et al.,2015,Melt Instabilities In An Intraplate Lithosphere An
.,B8YYFPNY,Regenauer-Lieb et al.,2015,Foreword Toward A Quantitative Understanding Of T
.,GC3QYNBI,Reimers,2015,The Importance Of Motions That Accompany Those Occ
.,VTSMRL3V,Reimers et al.,2015,"Non-Adiabatic Effects In Thermochemistry, Spectros"
.,HY2EFUCQ,Reimers et al.,2015,"Bond Angle Variations In Xh 3 [X = N, P"
.,BGBTS6MR,Reimers et al.,2015,A Priori Calculations Of The Free Energy Of Format
.,GLBDQ7EN,Ren et al.,2015,Mechanical Buckling Induced Periodic Kinkingstrip
.,UXNSCGL4,Ren et al.,2015,3d Hierarchical Porous Graphene Aerogel With Tunab
.,NEJ35YVV,Ren et al.,2015,Propensity For Distinguishing Two Free Electrons W
.,YMKMI3DP,Rijs et al.,2015,Mhd Wave Refraction And The Acoustic Halo Effect A
.,DCNE5UC6,Rincon Bonilla et al.,2015,Corrections To “Understanding Adsorption And Trans
.,WSWITBDR,Romanenko et al.,2015,New Insights Into The Thermal Behaviour Of Organic
.,LU8B9IVE,Rosic et al.,2015,Unfolding The Secrets Of Coral–Algal Symbiosis
.,8CQAUZV6,Rosso et al.,2015,Topographic Influence On Submesoscale Dynamics In 
.,SQRM9YQA,Ryan et al.,2015,The Emergence Of Age-Dependent Social Cognitive De
.,VRQH6MXI,Saez et al.,2015,Molecular Dynamics And Functional Studies Define A
.,G47B7DLB,Salehi et al.,2015,A Comparative Study Of Conditional Moment Closure 
.,VY8XJ9MK,Salim et al.,2015,"A Universal, Turbulence-Regulated Star Formation L"
.,B27A9MTE,Sandberg et al.,2015,Compressible Direct Numerical Simulation Of Low-Pr
.,B8Z82GU9,Sasse et al.,2015,Quantifying The Influence Of Co&Lt;Sub&Gt;2&Lt;Su
.,A6CRLCEM,Schnaidt and Heinson,2015,Bootstrap Resampling As A Tool For Uncertainty Ana
.,CR4RJP4U,Schneider et al.,2015,Understanding Star Formation In Molecular Clouds 
.,AKYFXNU8,Schneider et al.,2015,Understanding Star Formation In Molecular Clouds 
.,I99VBMVP,Schober et al.,2015,Saturation Of The Turbulent Dynamo
.,LGIYMJHL,Schofield et al.,2015,First Quasi-Lagrangian In Situ Measurements Of Ant
.,Z2ERC8XQ,Schrijver et al.,2015,Division E Commission 10 Solar Activity
.,TMN8YMLE,Seitenzahl et al.,2015,Neutrino And Gravitational Wave Signal Of A Delaye
.,X5W8XAHY,Seitenzahl et al.,2015,5.9-Kev Mn K-Shell X-Ray Luminosity From The Decay
.,4D6LZYW3,Serra et al.,2015,Askap H I Imaging Of The Galaxy Group Ic 1459
.,QE2R5CKJ,Setiadi et al.,2015,Computational Studies Of Glutamate Transporters
.,529KVH3L,Seton et al.,2015,Ridge Subduction Sparked Reorganization Of The Pac
.,A3G7XG37,Shade and Teal,2015,Computing Workflows For Biologists A Roadmap
.,SDJNDU8Q,Sharples et al.,2015,Styles Of Rifting And Fault Spacing In Numerical M
.,FHLI44MN,Sherwood,2015,The Sun And The Rain
.,XIVQGQL8,Sherwood and Nishant,2015,Atmospheric Changes Through 2012 As Shown By Itera
.,KHYNGVPN,Sherwood et al.,2015,Adjustments In The Forcing-Feedback Framework For 
.,52X5Y4BC,Shikhov and Arns,2015,Evaluation Of Capillary Pressure Methods Via Digit
.,TGPGWWBA,Shimwell et al.,2015,"Another Shock For The Bullet Cluster, And The Sour"
.,TUBAV6S4,Simpson et al.,2015,An Intermediate Band Dye-Sensitised Solar Cell Usi
.,6KMKDY2A,Smolentsev et al.,2015,An Approach To Verification And Validation Of Mhd 
.,5FGB2G2W,Song et al.,2015,Laser Enhanced Hydrogen Passivation Of Silicon Waf
.,567YSVPY,Soysa et al.,2015,"Size, Shape, And Diffusivity Of A Single Debye-Hüc"
.,E7NAJEX2,Spackman and Karton,2015,Estimating The Ccsd Basis-Set Limit Energy From Sm
.,TJ75TPLE,Steele et al.,2015,Mechanism Of Periodic Height Variations Along Self
.,CHAYHJA5,Steinman et al.,2015,Response To Comment On Atlantic And Pacific Multi
.,36NQIFII,Stokes et al.,2015,Parity-Expanded Variational Analysis For Nonzero M
.,WXNYGKU7,Stone et al.,2015,A New Dobson Umkehr Ozone Profile Retrieval Method
.,8ZSHD29Y,Strutton et al.,2015,Biogeochemical Variability In The Central Equatori
.,XPB8SZN5,Stuchbery et al.,2015,Target Acquired Progress And Promise Of Targeted 
.,N6IPEAJI,Sun et al.,2015,Fish-Scale Bio-Inspired Multifunctional Zno Nanost
.,W4SNMYN8,Ta et al.,2015,Thin Film Lubrication Of Hexadecane Confined By Ir
.,HE3JG3NU,Tan et al.,2015,Conductive Graphitic Carbon Nitride As An Ideal Ma
.,ARTGTAHW,Taubenberger et al.,2015,Spectroscopy Of The Type Ia Supernova 2011fe Past 
.,NTN8RPIK,Tawfik et al.,2015,Multiple Co 2 Capture In Stable Metal-D
.,6BVBQHSE,Teale and Young,2015,Multicomponent Delirium Prevention Not As Effecti
.,NG4ILZD5,Teale and Young,2015,A Patient Reported Experience Measure (Prem) For U
.,BW4BUQZV,Teng et al.,2015,How Does Bias Correction Of Regional Climate Model
.,9NYSJ3PW,Terrapon et al.,2015,On The Role Of Pressure In Elasto-Inertial Turbule
.,GRYEA2VG,The LIGO Scientific Collaboration et al.,2015,Advanced Ligo
.,LQVWIBHK,Thomas et al.,2015,Instanton Contributions To The Low-Lying Hadron Ma
.,RWY3US89,Thresher et al.,2015,Erratum Corrigendum Options For Managing Impacts
.,5E4FZHSE,Thyagarajan et al.,2015,Confirmation Of Wide-Field Signatures In Redshifte
.,3ITAS5TK,Thyagarajan et al.,2015,Foregrounds In Wide-Field Redshifted 21 Cm Power S
.,WXDNJL8A,Tingay et al.,2015,The Spectral Variability Of The Ghz-Peaked Spectru
.,Y7AR53XN,Tingay et al.,2015,A Search For Fast Radio Bursts At Low Frequencies 
.,ZRLES53V,Tkalčić et al.,2015,"Strong, Multi-Scale Heterogeneity In Earth’s Lower"
.,YQ62AQA3,Torlina et al.,2015,Interpreting Attoclock Measurements Of Tunnelling 
.,7VAVJTKV,Tosi et al.,2015,A Community Benchmark For Viscoplastic Thermal Con
.,4ME4ISV3,Tremblay et al.,2015,The High Time And Frequency Resolution Capabilitie
.,AS68J9T8,Trewartha et al.,2015,Connection Between Center Vortices And Instantons 
.,NETWRPJG,Trewartha et al.,2015,Evidence That Centre Vortices Underpin Dynamical C
.,TZ56V9WW,Tripathi et al.,2015,Simulated Photoevaporative Mass Loss From Hot Jupi
.,4B6DXN6W,Trott and Tingay,2015,The Effect Of Interplanetary Scintillation On Epoc
.,SH6LUK74,Turney et al.,2015,Obliquity‐Driven Expansion Of North Atlantic Sea I
.,SRQQZ4QF,Ujvari et al.,2015,Widespread Convergence In Toxin Resistance By Pred
.,KJZBJPJC,Ummenhofer et al.,2015,How Did Ocean Warming Affect Australian Rainfall E
.,CADXQCRW,Usman et al.,2015,Donor Hyperfine Stark Shift And The Role Of Centra
.,M8RUX89Z,Usman et al.,2015,Strain And Electric Field Control Of Hyperfine Int
.,4KZPTMLK,Utamuratov et al.,2015,Two-Center Close-Coupling Calculations Of Positron
.,IM9K7T9Y,van Sebille et al.,2015,Pairwise Surface Drifter Separation In The Western
.,FPD9YIB5,Varela et al.,2015,Electrochemical Method For Studying Localized Corr
.,C87IPCC2,Vélez et al.,2015,Cross Validation Of Poolingresampling Gwas Using 
.,6IY7E897,Verkhovtsev et al.,2015,Comparative Analysis Of The Secondary Electron Yie
.,QJJ7XTZN,Vikse et al.,2015,Prying Open A Reactive Site For Allylic Arylation 
.,CUEQ38M2,Voisin et al.,2015,Spatially Resolved Resonant Tunneling On Single At
.,UCJXCTET,Walsh et al.,2015,Hurricanes And Climate The U.s. Clivar Working Gr
.,PXB5ZYCV,Walsh et al.,2015,Hurricanes And Climate The U.s. Clivar Working Gr
.,VUEURWMD,Wang et al.,2015,Alcl 3 -Catalyzed Ring Expansion Cascad
.,RJSN3NAF,Wang et al.,2015,A Dye-Sensitized Visible Light Photocatalyst-Bi24o
.,GPAP8VHK,Wang et al.,2015,Preferential Attention To Animals And People Is In
.,V5PAU9I2,Wang et al.,2015,Pure Sea-Quark Contributions To The Magnetic Form 
.,X6YIMYUM,Wang et al.,2015,In-Situ One-Step Hydrothermal Synthesis Of A Lead 
.,8BLXSL4G,Wayth et al.,2015,Gleam The Galactic And Extragalactic All-Sky Mwa 
.,ANIRY4JW,Webb et al.,2015,The Impact Of Parametrized Convection On Cloud Fee
.,6BI5XPEE,Williams et al.,2015,Absolute Plate Motions Since 130 Ma Constrained By
.,HIZ7DPPN,Woosley and Heger,2015,The Remarkable Deaths Of 9–11 Solar Mass Stars
.,JKCDBWZZ,Wright et al.,2015,Development Of A Snp-Based Assay For Measuring Gen
.,4ZZEY582,Xiong et al.,2015,Microstructures And Mechanical Properties Of Dual 
.,PKNTZZQ9,Xu et al.,2015,Sulfur Isotopic Compositions Of Submicrometer Sic 
.,TXPANGIF,Xu et al.,2015,Effects Of Oxygen Adsorption On The Surface State 
.,LG6E8NQ3,Yang et al.,2015,Dual Yolk-Shell Structure Of Carbon And Silica-Coa
.,LECER9BX,Ye et al.,2015,Understanding The Origin Of Li 2 Mno S
.,H4TCMSLP,Yen et al.,2015,Role Of Stress-Assisted Martensite In The Design O
.,XXQ6CLTN,Yin et al.,2015,Tunable Hybridization Between Electronic States Of
.,TYBBFAIR,Young et al.,2015,The Second National Audit Of Intermediate Care
.,HZ9SRPNP,Young et al.,2015,Prevention Of Delirium (Pod) For Older People In H
.,GB22TJ2Q,Yu and Shen,2015,Iron And Steel Making In Australia And China
.,NMGE6CFM,Zahirovic et al.,2015,Tectonic Speed Limits From Plate Kinematic Reconst
.,CP9NYQJ7,Zammit et al.,2015,Convergent Calculations Of Positron Scattering Fro
.,NWB2WIF8,Zammit et al.,2015,Calculations Of Electron And Positron Scattering F
.,BI7JVJKZ,Zavras et al.,2015,"Synthesis, Structure And Gas-Phase Reactivity Of T"
.,KYDU6UR8,Zeng et al.,2015,Multi-Model Simulation Of Co And Hcho In The South
.,8SEBEWPA,Zhai et al.,2015,"Sea-Ice Conditions In The Adélie Depression, Antar"
.,PTEA7K6X,Zhang et al.,2015,At Rtdspa
.,V6AKZHX5,Zhang et al.,2015,Plasmonic Nanostructures To Enhance Catalytic Perf
.,KN5JCT7V,Zhang et al.,2015,Experimental Study Of Laminated Glass Window Respo
.,95QMRQMV,Zhang et al.,2015,Conformation Of Hydrophobically Modified Thermores
.,K5B47LQM,Zhang et al.,2015,The Mechanical Properties Of Polyvinyl Butyral (Pv
.,V5RTVKQU,Zheng et al.,2015,3d Fe2(Moo4)3 Microspheres With Nanosheet Constitu
.,NYXSPK4K,Zhou et al.,2015,Leaf-Excluded Percolation In Two And Three Dimensi
.,CV3QY8MW,Zhou et al.,2015,New Family Of Quantum Spin Hall Insulators In Two-
.,CMKZSZWN,Zhu et al.,2015,Correction Controlling Molecular Ordering In Solu
.,H92UBRBT,Zhuang et al.,2015,Unabridged Phase Diagram For Single-Phased Fesexte
.,PS9FL7L7,Zhuang et al.,2015,Investigation Of Electron-Phonon Coupling In Epita
.,HAKKFZ86,Zhuang et al.,2015,Pauli-Limited Effect In The Magnetic Phase Diagram
.,HLLFVIRH,Aasi et al.,2016,First Low Frequency All-Sky Search For Continuous 
.,YJS99NJJ,Aasi et al.,2016,Search Of The Orion Spur For Continuous Gravitatio
.,BIQQ8TNE,Abberton et al.,2016,Global Agricultural Intensification During Climate
.,IWC8K66H,Abbott et al.,2016,Astrophysical Implications Of The Binary Black Hol
.,T8WK87VS,Abbott et al.,2016,The Rate Of Binary Black Hole Mergers Inferred Fro
.,VQGH5XF4,Abbott et al.,2016,First Targeted Search For Gravitational-Wave Burst
.,7SKTNZN4,Abbott et al.,2016,Localization And Broadband Follow-Up Of The Gravit
.,X7Q958HA,Abbott et al.,2016,Binary Black Hole Mergers In The First Advanced Li
.,GZ8DVDHX,Abbott et al.,2016,Gw151226 Observation Of Gravitational Waves From 
.,7YNTB5QL,Abbott et al.,2016,All-Sky Search For Long-Duration Gravitational Wav
.,3P2NGQHC,Abbott et al.,2016,Properties Of The Binary Black Hole Merger Gw15091
.,EG8423GQ,Abbott et al.,2016,Tests Of General Relativity With Gw150914
.,MQAXHJYQ,Abbott et al.,2016,Comprehensive All-Sky Search For Periodic Gravitat
.,ZUL96HAZ,Abbott et al.,2016,Upper Limits On The Rates Of Binary Neutron Star A
.,4TZTM322,Abbott et al.,2016,Characterization Of Transient Noise In Advanced Li
.,U7HEL684,Abbott et al.,2016,Improved Analysis Of Gw150914 Using A Fully Spin-P
.,CRPDXQHU,Abbott et al.,2016,Results Of The Deepest All-Sky Survey For Continuo
.,A8KDTP7B,Abbott et al.,2016,Observation Of Gravitational Waves From A Binary B
.,QN38HNCG,Abbott et al.,2016,Supplement “Localization And Broadband Follow-Up 
.,NZU5UZKF,Abbott et al.,2016,Search For Transient Gravitational Waves In Coinci
.,XLNALPIZ,Abbott et al.,2016,Gw150914 First Results From The Search For Binary
.,8RBU73UM,Abbott et al.,2016,Directly Comparing Gw150914 With Numerical Solutio
.,XDWSXW9E,Abbott et al.,2016,Observing Gravitational-Wave Transient Gw150914 Wi
.,PRBG6R2L,Abbott et al.,2016,Gw150914 Implications For The Stochastic Gravitat
.,NMSXJ78V,Abbott et al.,2016,Gw150914 The Advanced Ligo Detectors In The Era O
.,FHPLYF5N,Abbott et al.,2016,Supplement “The Rate Of Binary Black Hole Mergers
.,B82AU4T8,Abdurakhmanov et al.,2016,Wave-Packet Continuum-Discretization Approach To I
.,RDRI3QGM,Abellán and McGregor,2016,"The Role Of The Southward Wind Shift In Both, The "
.,EAXERR2B,Abreu et al.,2016,Nitroxide-Mediated Polymerization Of Vinyl Chlorid
.,UTHNBTPV,Acosta et al.,2016,Piezoelectricity And Rotostriction Through Polar A
.,NGB23ZKK,Adams et al.,2016,Outcome Of The First Wwpdbccdcd3r Ligand Validat
.,B65XYZRS,Adrián-Martínez et al.,2016,High-Energy Neutrino Follow-Up Search Of Gravitati
.,8SC5Y4IC,Agostino et al.,2016,Optimization Of Protein-Protein Docking For Predic
.,UJRF8458,Aili et al.,2016,Exceptional Durability Enhancement Of Papbi Based
.,LWELFTJA,Al-keisy et al.,2016,A Ferroelectric Photocatalyst Ag 10 Si 
.,5EWFHEK6,Alaal et al.,2016,First Principles Many-Body Calculations Of Electro
.,FAXKJ2A4,Alevizos et al.,2016,Analysis Of Dynamics In Multiphysics Modelling Of 
.,2JIBWYUI,Allison et al.,2016,Recent Developments In Geant4
.,UBGUBVEF,Allison et al.,2016,Erratum Discovery Of H I Gas In A Young Radio Gal
.,ZPVXRVXN,Allison et al.,2016,Tracing The Neutral Gas Environments Of Young Radi
.,HUIGFWWD,Ananthoju et al.,2016,Cationanion Substitution In Cu2znsns4 For Improve
.,CLMSIQNX,Andrews et al.,2016,Association Of Genetic Risk Factors With Cognitive
.,9ZLQPHQC,Andrys et al.,2016,Evaluation Of A Span Style=Font-Variantsmall-Ca
.,HCHVVP6Y,Aragonès et al.,2016,Electrostatic Catalysis Of A Diels–Alder Reaction
.,96XD7LJ3,Argüeso et al.,2016,Seasonal Mean Temperature Changes Control Future H
.,3UJMKV9W,Arora et al.,2016,Ionospheric Modelling Using Gps To Calibrate The M
.,H34Q8W2B,Askerka et al.,2016,The Mod-Qmmm Method
.,743R6LX9,Avazbaev et al.,2016,Polarization Of Lyman- Α Emission In Proton-Hydrog
.,PXF7JWJR,Azofra et al.,2016,A Dft Study Of Planar Vs. Corrugated Graphene-Like
.,7BZHZJN9,Azofra et al.,2016,An Intensified Π-Hole In Beryllium-Doped Boron Nit
.,8SCQU2IB,Badia and Nguyen,2016,Balancing Domain Decomposition By Constraints And 
.,43V6KWZU,Badia et al.,2016,Multilevel Balancing Domain Decomposition At Extre
.,ZBQNM9AG,Baghbanzadeh and Kassal,2016,Distinguishing The Roles Of Energy Funnelling And 
.,JJKWHHMJ,Bai et al.,2016,Identifying Anomalous Citations For Objective Eval
.,8YRJUIJA,Bakhsh et al.,2016,Linear Simulations Of The Cylindrical Richtmyer-Me
.,5JL7F63G,Balasubramaniam et al.,2016,New Data From Basal Australian Songbird Lineages S
.,HBYP7WAX,Banda-Barragán et al.,2016,Filament Formation In Wind–Cloud Interactions – I.
.,UGTUFXL8,Bandrowski et al.,2016,The Ontology For Biomedical Investigations
.,PMPRD8GM,Banerjee et al.,2016,Evidence From Stable Isotopes And 10be For Solar S
.,2TAYVJXM,Batley and Edwards,2016,The Application Of Genomics And Bioinformatics To 
.,ZNKULNR9,Bavi et al.,2016,The Role Of Mscl Amphipathic N Terminus Indicates 
.,BFZX8KGZ,Beardsley et al.,2016,First Season Mwa Eor Power Spectrum Results At Red
.,F7FE2KGE,Beck et al.,2016,Global-Scale Regionalization Of Hydrologic Model P
.,D669SX2F,Bedon et al.,2016,"Advancements In Design, Analysis, And Retrofitting"
.,6YKKBK8I,Belczynski et al.,2016,The Effect Of Pair-Instability Mass Loss On Black-
.,MF6AQV4V,Bell et al.,2016,Time-Domain And Spectral Properties Of Pulsars At 
.,R59UICQL,Bell et al.,2016,The Influence Of Alloying Elements On The Corrosio
.,MTHYVZPJ,Bellstedt et al.,2016,The Evolution In The Stellar Mass Of Brightest Clu
.,APTJR4G2,Bernardi and Searles,2016,Local Response In Nanopores
.,I8B4EAVC,Bernardi et al.,2016,Kat-7 Observations Of An Unbiased Sample Of Mass-S
.,Q6HPY3WE,Biggerstaff et al.,2016,Enhancing Coherent Transport In A Photonic Network
.,PXC5DTAK,Blackwell et al.,2016,Iterative Learning Control Applied To A Non-Linear
.,V3WZWMK2,Bodman et al.,2016,How Do Carbon Cycle Uncertainties Affect Ipcc Temp
.,DZJXR37N,Botha and Sheppard,2016,Mapping Permeability In Low-Resolution Micro-Ct Im
.,CZ6HL3H2,Boucharel et al.,2016,Modes Of Hurricane Activity Variability In The Eas
.,LUGL8K7E,Boucharel et al.,2016,Influence Of Oceanic Intraseasonal Kelvin Waves On
.,DDL8L75M,Boucharel et al.,2016,Different Controls Of Tropical Cyclone Activity In
.,YKG5UPXL,Bourne and Power,2016,Simulating Feedback From Nuclear Clusters The Imp
.,75BFFIU4,Brandt et al.,2016,Quantitative Analysis Of Step-Growth Polymers By S
.,VTKBP3CK,Braune et al.,2016,Electron Angular Distributions Of Noble Gases In S
.,8J8VNETI,Bristow et al.,2016,Free Energy Of Ligand Removal In The Metal–Organic
.,T3LGPRCF,Bristow et al.,2016,A General Forcefield For Accurate Phonon Propertie
.,Q9CEMMZP,Broughton et al.,2016,On The Propagation And Mode Conversion Of Auroral 
